{
  "$schema": "http://json-schema.org/draft-2020-12/schema",
  "$id": "geomap-spec.schema.json",
  "title": "GeoMap Engine Specification",
  "description": "Schema for @knowledgeassemble/geomap-engine specifications (P4 slice).",
  "type": "object",
  "required": ["type", "version", "id"],
  "additionalProperties": false,
  "properties": {
    "type": { "const": "geomap" },
    "version": { "type": "string", "pattern": "^\\d+\\.\\d+\\.\\d+$" },
    "id": { "type": "string", "pattern": "^[a-zA-Z][a-zA-Z0-9._-]*$", "maxLength": 128 },
    "metadata": {
      "type": "object",
      "additionalProperties": false,
      "properties": {
        "title": { "type": "string" },
        "description": { "type": "string" },
        "author": { "type": "string" }
      }
    },
    "purpose": {
      "type": "object",
      "additionalProperties": false,
      "properties": {
        "learningObjective": { "type": "string" },
        "reasoningMode": { "type": "string" }
      },
      "required": ["learningObjective"]
    },
    "content": {
      "type": "object",
      "additionalProperties": false,
      "properties": {
        "viewport": {
          "type": "object",
          "additionalProperties": false,
          "properties": {
            "fit": { "const": "content" },
            "padding": { "type": "number", "minimum": 0, "maximum": 0.5 },
            "center": {
              "type": "object",
              "additionalProperties": false,
              "properties": {
                "lat": { "type": "number", "minimum": -90, "maximum": 90 },
                "lon": { "type": "number", "minimum": -180, "maximum": 180 }
              },
              "required": ["lat", "lon"]
            },
            "zoom": { "type": "number", "minimum": 0, "maximum": 20 }
          }
        },
        "projection": {
          "type": "object",
          "additionalProperties": false,
          "properties": {
            "type": { "type": "string", "enum": ["equirectangular"] }
          },
          "required": ["type"]
        },
        "geography": {
          "type": "object",
          "additionalProperties": false,
          "properties": {
            "sources": {
              "type": "array",
              "items": {
                "type": "object",
                "additionalProperties": false,
                "properties": {
                  "id": { "type": "string", "pattern": "^[a-zA-Z][a-zA-Z0-9._-]*$" },
                  "type": { "const": "geojson" },
                  "class": { "type": "string", "enum": ["authoritative", "illustrative", "simulated"] },
                  "data": { "type": "object" },
                  "uri": { "type": "string" }
                },
                "required": ["id", "type", "class"],
                "anyOf": [
                  { "required": ["data"] },
                  { "required": ["uri"] }
                ]
              }
            }
          },
          "required": ["sources"]
        },
        "entities": {
          "type": "array",
          "items": {
            "type": "object",
            "additionalProperties": false,
            "properties": {
              "id": { "type": "string", "pattern": "^[a-zA-Z][a-zA-Z0-9._-]*$" },
              "type": { "type": "string", "enum": ["country", "state", "province", "region", "city", "town", "village", "river", "lake", "mountain", "landmark", "place"] },
              "name": { "type": "string", "minLength": 1 },
              "description": { "type": "string" },
              "location": {
                "type": "object",
                "additionalProperties": false,
                "properties": {
                  "source": { "type": "string" },
                  "featureId": { "type": "string" },
                  "coordinates": {
                    "type": "object",
                    "additionalProperties": false,
                    "properties": {
                      "lat": { "type": "number", "minimum": -90, "maximum": 90 },
                      "lon": { "type": "number", "minimum": -180, "maximum": 180 }
                    },
                    "required": ["lat", "lon"]
                  }
                },
                "anyOf": [
                  { "required": ["source", "featureId"] },
                  { "required": ["coordinates"] }
                ]
              },
              "links": { "type": "object", "additionalProperties": { "type": "string" } }
            },
            "required": ["id", "type", "name", "location"]
          }
        },
        "layers": {
          "type": "array",
          "items": {
            "type": "object",
            "additionalProperties": false,
            "properties": {
              "id": { "type": "string", "pattern": "^[a-zA-Z][a-zA-Z0-9._-]*$" },
              "type": { "type": "string", "enum": ["region", "marker", "route", "label"] },
              "title": { "type": "string" },
              "visible": { "type": "boolean" },
              "style": {
                "type": "object",
                "additionalProperties": false,
                "properties": {
                  "role": { "type": "string", "enum": ["primary-region", "secondary-region", "marker", "route", "label", "highlight", "selected", "approximate"] }
                }
              },
              "items": { "type": "array", "minItems": 1 }
            },
            "required": ["id", "type", "items"]
          }
        },
        "legend": {
          "type": "object",
          "additionalProperties": false,
          "properties": {
            "visible": { "type": "boolean" },
            "items": {
              "type": "array",
              "items": {
                "type": "object",
                "additionalProperties": false,
                "properties": {
                  "role": { "type": "string" },
                  "label": { "type": "string" }
                },
                "required": ["role", "label"]
              }
            }
          }
        }
      }
    },
    "interaction": {
      "type": "object",
      "additionalProperties": false,
      "properties": {
        "mode": { "type": "string" },
        "actions": {
          "type": "array",
          "items": { "type": "string" }
        }
      }
    },
    "questions": { "type": "array" },
    "sources": {
      "type": "array",
      "items": {
        "type": "object",
        "additionalProperties": false,
        "properties": {
          "class": { "type": "string", "enum": ["authoritative", "illustrative", "simulated"] }
        },
        "required": ["class"]
      }
    },
    "accessibility": {
      "type": "object",
      "additionalProperties": false,
      "properties": {
        "label": { "type": "string" },
        "description": { "type": "string" }
      }
    }
  }
}